{"schema":"rie.source_evaluation.v1","evaluation_id":"eval_20260308050358940_ddc945abd8f7","evaluated_at_utc":"2026-03-08T05:03:58.9400787Z","source_id":"s_watchlist_001","source_hash":"","audience_band":"child_7_10","domain_profile_ref":"wikipedia.org","checks":[{"check_id":"chk_prov","kind":"provenance_present","status":"pass","detail":"Required provenance fields present.","reason_code":"ALLOW_CHILD_SAFE_TRUSTED_EDU"},{"check_id":"chk_answer","kind":"forbidden_answer_like_pattern","status":"pass","detail":"No forbidden answer-like fields present.","reason_code":"ALLOW_CHILD_SAFE_TRUSTED_EDU"},{"check_id":"chk_domain","kind":"domain_policy","status":"warn","detail":"Domain is watch-listed.","reason_code":"DOWNRANK_LOW_SIGNAL"},{"check_id":"chk_anchor","kind":"institutional_or_publisher_anchor","status":"pass","detail":"Institutional or publisher anchor present.","reason_code":"ALLOW_CHILD_SAFE_TRUSTED_EDU"},{"check_id":"chk_trust","kind":"trust_signal_count","status":"pass","detail":"Trust signal count=1","reason_code":"ALLOW_CHILD_SAFE_TRUSTED_EDU"},{"check_id":"chk_comm","kind":"community_source_gate","status":"pass","detail":"Not classified as community source.","reason_code":"ALLOW_CHILD_SAFE_TRUSTED_EDU"},{"check_id":"chk_domshare","kind":"domain_dominance_risk","status":"warn","detail":"Watch-listed domain contributes dominance risk.","reason_code":"DOWNRANK_DOMAIN_DOMINANCE"}],"summary":{"passed_count":5,"warn_count":2,"failed_count":0,"final_recommendation":"DOWNRANK"}}
