{"schema":"rie.source_evaluation.v1","evaluation_id":"eval_20260308050358897_38efecf0cbe3","evaluated_at_utc":"2026-03-08T05:03:58.8975610Z","source_id":"s_deny_answer_001","source_hash":"","audience_band":"child_7_10","domain_profile_ref":"coursehero.com","checks":[{"check_id":"chk_prov","kind":"provenance_present","status":"pass","detail":"Required provenance fields present.","reason_code":"ALLOW_CHILD_SAFE_TRUSTED_EDU"},{"check_id":"chk_answer","kind":"forbidden_answer_like_pattern","status":"fail","detail":"Answer-like or solution-like fields are present.","reason_code":"DENY_FORBIDDEN_ANSWER_CONTENT"},{"check_id":"chk_domain","kind":"domain_policy","status":"fail","detail":"Domain is denylisted.","reason_code":"DENY_DOMAIN_POLICY_BLOCKED"},{"check_id":"chk_anchor","kind":"institutional_or_publisher_anchor","status":"fail","detail":"Required institutional or publisher anchor missing.","reason_code":"DENY_AUDIENCE_POLICY_CHILD_SAFE"},{"check_id":"chk_trust","kind":"trust_signal_count","status":"fail","detail":"Trust signal count=0 is below required minimum=1","reason_code":"DENY_LOW_TRUST_UNVERIFIED_SOURCE"},{"check_id":"chk_comm","kind":"community_source_gate","status":"pass","detail":"Not classified as community source.","reason_code":"ALLOW_CHILD_SAFE_TRUSTED_EDU"}],"summary":{"passed_count":2,"warn_count":0,"failed_count":4,"final_recommendation":"DENY"}}
